word,pos,meaning,example
abandon,v.,放弃,They had to abandon the plan.
abstract,adj.,抽象的,The idea is too abstract for children.
abundant,adj.,丰富的,The region has abundant resources.
access,n.,通道；接近,Students need access to the library.
accommodate,v.,容纳；适应,The hotel can accommodate 200 guests.
accumulate,v.,积累,Dust accumulated on the shelves.
accurate,adj.,准确的,The report is accurate and detailed.
acknowledge,v.,承认,He acknowledged his mistake.
acquire,v.,获得,She acquired new skills quickly.
adapt,v.,适应,Animals adapt to their environment.
adequate,adj.,足够的,We have adequate supplies for the trip.
adjacent,adj.,邻近的,Our room is adjacent to the garden.
adjust,v.,调整,Please adjust the volume.
advocate,v.,提倡,She advocates for environmental protection.
aesthetic,adj.,美学的,The design has aesthetic appeal.
affect,v.,影响,Weather affects our mood.
aggregate,n.,总计,The aggregate score was impressive.
allocate,v.,分配,Funds were allocated to education.
alternative,n.,选择,We need an alternative solution.
ambiguous,adj.,模糊的,His answer was ambiguous.
analyze,v.,分析,Scientists analyze the data carefully.
annual,adj.,每年的,The annual meeting is in March.
anticipate,v.,预期,We anticipate strong demand.
anxiety,n.,焦虑,She felt anxiety before the exam.
apparent,adj.,明显的,It was apparent that he was tired.
appeal,v.,吸引；上诉,The idea appeals to young people.
appreciate,v.,欣赏；感激,I appreciate your help.
approach,n.,方法；接近,We need a new approach.
appropriate,adj.,适当的,Wear appropriate clothing.
approximate,adj.,大约的,The approximate cost is $500.
arbitrary,adj.,任意的,The decision seemed arbitrary.
articulate,v.,清楚表达,She articulates her ideas well.
aspect,n.,方面,Consider every aspect of the problem.
assemble,v.,组装；集合,Workers assemble the parts.
assess,v.,评估,Teachers assess student progress.
assign,v.,分配,The teacher assigned homework.
assist,v.,协助,Volunteers assist the elderly.
assume,v.,假设,Don't assume you know the answer.
assure,v.,保证,I assure you it is safe.
atmosphere,n.,大气；氛围,The restaurant has a cozy atmosphere.
attach,v.,附上,Attach the file to the email.
attain,v.,达到,She attained her goal.
attitude,n.,态度,A positive attitude helps.
attribute,v.,归因于,Success is attributed to hard work.
authentic,adj.,真实的,This is an authentic antique.
authority,n.,权威,The mayor has local authority.
available,adj.,可用的,Tickets are available online.
benefit,n.,利益,Exercise has many health benefits.
bias,n.,偏见,We must avoid bias in research.
brief,adj.,简短的,He gave a brief summary.
capacity,n.,容量；能力,The hall has a capacity of 500.
cease,v.,停止,The rain ceased at noon.
challenge,n.,挑战,Climate change is a global challenge.
channel,n.,渠道,Use the official channel for updates.
circumstance,n.,情况,Under the circumstances, we waited.
cite,v.,引用,Please cite your sources.
civil,adj.,公民的；文明的,Civil rights are important.
clarify,v.,澄清,Let me clarify my position.
classic,adj.,经典的,It is a classic novel.
coherent,adj.,连贯的,Write a coherent essay.
coincide,v.,巧合；一致,Our views coincide on this issue.
collapse,v.,倒塌；崩溃,The bridge collapsed in the storm.
colleague,n.,同事,She discussed it with a colleague.
commence,v.,开始,The ceremony will commence at ten.
comment,n.,评论,He made a helpful comment.
commit,v.,承诺；犯（错）,She committed to the project.
commodity,n.,商品,Oil is a valuable commodity.
communicate,v.,交流,We communicate by email.
community,n.,社区,The local community is supportive.
compatible,adj.,兼容的,The software is compatible with Mac.
compensate,v.,补偿,The company will compensate workers.
competent,adj.,有能力的,She is a competent manager.
compile,v.,编译；汇编,He compiled a list of names.
complement,v.,补充,The wine complements the meal.
complex,adj.,复杂的,It is a complex problem.
component,n.,组成部分,Each component is tested.
compose,v.,组成；创作,Water is composed of hydrogen and oxygen.
compound,n.,化合物,Salt is a chemical compound.
comprehensive,adj.,全面的,We need a comprehensive plan.
comprise,v.,包含,The team comprises ten members.
conceive,v.,构想,He conceived a brilliant idea.
concentrate,v.,集中,Concentrate on your studies.
concept,n.,概念,The concept is easy to understand.
conclude,v.,结论,We conclude that it works.
conduct,v.,进行；引导,They conduct research annually.
confine,v.,限制,Please confine your remarks to the topic.
